{
  "schema": 1,
  "id": "account_closure_2",
  "name": "Recovery Detail",
  "flavor": "The factor is pleased, and offers you a follow-on opportunity. Three recovery specialists need a quiet ride out to a Freehold berth where a certain hull is about to change owners. They are polite, professional, and heavily insured. The account holder will not be expecting them.",
  "acquisition": "triggered",
  "slots": {
    "company": { "from": "parent.company" },
    "depot": { "from": "parent.dest" },
    "seizure_site": { "kind": "station", "constraints": { "faction_is": "freehold" } }
  },
  "eligibility": { "min_passenger_berths": 3 },
  "completion": {
    "docked_at": "${seizure_site}",
    "deliver_item": { "item": "repo_crew" }
  },
  "deadline_s": 1800,
  "items": [
    {
      "id": "repo_crew",
      "name": "Company Recovery Detail",
      "space": "berth",
      "units": 3,
      "pickup_at": "${depot}"
    }
  ],
  "rewards": {
    "credits": 1400,
    "rep": [
      { "target": "${company}", "delta": 15 },
      { "target": "freehold", "delta": -15 }
    ]
  },
  "on_complete": [
    {
      "quest": "account_closure_3",
      "offer": { "mode": "first_refusal", "window_s": 900, "then": "expire" }
    }
  ]
}
